"A2A 交付验收与放款","A2A 交付验收与放款"
订单角色归属,"Order role assignments"
可执行动作矩阵,"Executable action matrix"
同一个订单在不同角色下会暴露不同动作。被阻断的动作不会进入资金或仲裁写入。,"The same order exposes different actions by role. Blocked actions do not write funds or arbitration state."
验证此动作,"Verify this action"
打开业务入口,"Open business entry"
每个敏感动作必须对应正式订单里的角色归属；登录账号绑定完成前仍属于原型授权。,"Every sensitive action must map to a formal order role assignment. Before account binding is complete, authorization remains prototype-level."
绑定当前角色,"Bind current role"
绑定主体,"Bound subject"
硬性守卫规则,"Hard guard rules"
托管账本状态,"Escrow ledger status"
"A2A 结算分支导航","A2A settlement branch navigation"
查看验收页,"View acceptance page"
生成仲裁裁决,"Generate arbitration ruling"
无法进入结算分支,"Unable to enter settlement branch"
结算分支不可执行,"Settlement branch is not executable"
证据快照已锁定,"Evidence snapshot locked"
账本状态已更新,"Ledger status updated"
订单金额,"Order amount"
案件主键,"Case primary key"
仲裁证据包,"Arbitration evidence package"
退款证据包,"Refund evidence package"
结算分支必须保留验收快照、交付证据和账本影响，供后续仲裁与信誉重算使用。,"Settlement branch must retain acceptance snapshot, delivery evidence, and ledger impact for later arbitration and reputation recalculation."
账本影响,"Ledger impact"
当前托管账本,"Current escrow ledger"
仲裁流程,"Arbitration flow"
退款复核流程,"Refund review flow"
"A2A 钱包监控导航","A2A wallet monitor navigation"
返回仲裁裁决,"Back to arbitration ruling"
查看平台风控,"View platform risk"
无法执行钱包监控,"Unable to execute wallet monitor"
钱包监控不可执行,"Wallet monitor is not executable"
钱包执行模式切换,"Wallet execution mode switch"
每条钱包指令必须带幂等键、执行状态、失败原因和对账结果，避免重复放款或退款。,"Every wallet instruction must carry idempotency key, execution state, failure reason, and reconciliation result to avoid duplicate releases or refunds."
执行模式,"Execution mode"
已确认,Confirmed
资金边界,"Fund boundary"
钱包指令执行表,"Wallet instruction execution table"
失败原因,"Failure reason"
对账结果,"Reconciliation result"
重试次数,"Retry count"
未执行,"Not executed"
执行时间,"Execution time"
未对账,"Not reconciled"
对账时间,"Reconciliation time"
是,Yes
否,No
适配器执行契约,"Adapter execution contract"
裁决摘要,"Ruling summary"
裁决时间,"Ruling time"
"当前会话角色不能执行“%{1}”，需要 %{2}。","The current session role cannot perform ""%{1}"". Required role: %{2}."
"当前订单角色尚未绑定账号/权限组，不能执行“%{1}”。请先在角色权限控制台绑定当前角色。","The current order role is not bound to an account or permission group, so ""%{1}"" cannot be performed. Bind the current role in the role permission console first."
"提交 Agent 执行范围","Submit Agent execution scope"
"验收交付并释放托管","Accept delivery and release escrow"
"发起争议仲裁/冻结复核","Open dispute arbitration / freeze review"
"签发仲裁裁决与钱包指令","Issue arbitration ruling and wallet instructions"
"模拟钱包失败","Simulate wallet failure"
"重试失败钱包指令","Retry failed wallet instructions"
"查看钱包监控","View wallet monitor"
"A2A Agent 交付证据提交","A2A Agent delivery evidence submission"
"Agent 尚未提交执行范围，不能提交交付证据。","The Agent has not submitted the execution scope yet, so delivery evidence cannot be submitted."
"Agent 已提交交付证据，等待买方验收","The Agent has submitted delivery evidence and is waiting for buyer acceptance."
"交付证据只证明 Agent 已完成约定输出，不自动释放托管。","Delivery evidence only proves the Agent completed the agreed output; it does not automatically release escrow."
"买方必须使用绑定账号进入验收页，才能触发放款或退款/争议分支。","The buyer must enter the acceptance page with a bound account before release, refund review, or dispute flows can be triggered."
"平台后续风控、仲裁和信誉评分都引用同一份交付证据快照。","Platform risk control, arbitration, and reputation scoring all reference the same delivery evidence snapshot."
"已写入 Agent 交付证据快照，验收门禁已打开","Agent delivery evidence snapshot saved; the acceptance gate is now open."
"执行范围快照：%{1}","Execution scope snapshot: %{1}"
"运行日志包：runlog-%{1}.jsonl，含工具版本、参数和异常行清单","Run log package: runlog-%{1}.jsonl, including tool versions, parameters, and exception rows."
"输出校验摘要：%{1}","Output checksum summary: %{1}"
"API / 数据使用声明：仅使用买方授权输入和本地沙箱工具，未触发外部 API 外发","API / data usage declaration: only buyer-authorized input and local sandbox tools were used; no external API export was triggered."
"质量摘要：完成抽样复核、异常说明和可追溯输出文件索引","Quality summary: sampling review, exception notes, and traceable output file index completed."
"验收门禁：等待买方绑定账号进入验收页，不自动释放托管","Acceptance gate: waiting for the buyer to enter the acceptance page with a bound account; escrow is not automatically released."
"提交 Agent 交付证据","Submit Agent delivery evidence"
"无法提交交付证据","Unable to submit delivery evidence"
"Agent 交付提交不可执行","Agent delivery submission is not executable"
"Agent 交付证据已提交","Agent delivery evidence submitted"
"证据已留痕","Evidence recorded"
"等待买方验收，不释放托管","Waiting for buyer acceptance; escrow is not released"
"输出哈希","Output hash"
"切换到买方验收控制台","Switch to buyer acceptance console"
"交给买方验收","Hand off to buyer acceptance"
"返回 Agent 控制台","Return to Agent console"
"Agent 交付证据包","Agent delivery evidence package"
"交付提交只形成证据快照，买方验收或争议分支才会影响托管资金。","Delivery submission only creates an evidence snapshot; buyer acceptance or dispute branches are what affect escrow funds."
"放款门禁","Release gate"
"当前动作不会释放托管。只有买方绑定角色完成验收，或仲裁员签发裁决后，账本才会流转。","This action does not release escrow. The ledger moves only after a bound buyer accepts or an arbitrator issues a ruling."
"控制点","Control points"
"信任标签","Trust tags"
"提交 Agent 交付证据，不释放托管","Submit Agent delivery evidence without releasing escrow"
"Agent 尚未提交交付证据，不能进入买方验收放款。","The Agent has not submitted delivery evidence, so buyer acceptance and fund release cannot proceed."
"Agent 交付证据编号：%{1}","Agent delivery evidence ID: %{1}"
"Agent 提交时间：%{1}","Agent submission time: %{1}"
"Agent 输出哈希：%{1}","Agent output hash: %{1}"
"只有 Agent 已提交交付证据且没有退款/争议分支时，买方才能验收。","The buyer can accept only after the Agent has submitted delivery evidence and no refund or dispute branch exists."
"必须先完成执行范围、权限和证据清单；该动作不会释放托管。","Execution scope, permissions, and evidence checklist must be completed first; this action does not release escrow."
"交付证据已提交","Delivery evidence submitted"
"A2A 交付验收与放款","A2A delivery acceptance and release"
"确认验收并释放托管","Confirm acceptance and release escrow"
"要求 Agent 返工并保持托管冻结","Request Agent rework and keep escrow frozen"
"审阅交付证据并选择验收决策","Review delivery evidence and choose an acceptance decision"
"订单已进入退款、争议或返工分支，不能直接验收放款。","The order is already in a refund, dispute, or rework branch and cannot be directly accepted for release."
"订单已验收放款，不能再要求返工。","The order has already been accepted and released, so rework can no longer be requested."
"买方要求返工，托管资金继续冻结","Buyer requested rework; escrow remains frozen"
"已写入返工请求，托管账本保持冻结","Rework request saved; escrow ledger remains frozen"
"验收决策无效。","Invalid acceptance decision."
"订单已进入异常分支","The order has entered an exception branch"
"等待买方审阅交付证据并选择处理分支","Waiting for the buyer to review delivery evidence and choose a handling branch"
"订单已有结算分支，当前页仅展示验收证据","The order already has a settlement branch; this page only shows acceptance evidence"
"已有验收快照，当前页未新增放款动作","An acceptance snapshot already exists; this page did not add a release action"
"仅预览交付证据，托管资金仍保持冻结","Delivery evidence preview only; escrow funds remain frozen"
"A2A 买方验收决策","A2A buyer acceptance decision"
"可发起","Available"
"需先形成验收或返工快照","Requires an acceptance or rework snapshot first"
"确认验收并放款","Confirm acceptance and release funds"
"待下一版交付","Waiting for the next delivery version"
"确认交付达标后释放买方冻结金额、确认平台服务费，并把 Agent 收入置为待结算。","After confirming delivery quality, release the buyer freeze, capture the platform fee, and mark Agent income as pending settlement."
"要求返工，继续冻结","Request rework and keep frozen"
"不可执行","Unavailable"
"交付证据不足时写入返工快照，买方资金、平台费和 Agent 收入继续冻结。","When delivery evidence is insufficient, save a rework snapshot and keep buyer funds, platform fee, and Agent income frozen."
"交付无法补正时，买方可基于验收或返工快照进入退款复核。","If delivery cannot be corrected, the buyer can enter refund review from an acceptance or rework snapshot."
"范围、权限或输出质量存在重大分歧时，提交仲裁员冻结复核。","When scope, permissions, or output quality are materially disputed, submit to arbitrator frozen review."
"买方资金继续冻结，等待返工","Buyer funds remain frozen, waiting for rework"
"平台服务费继续预留，等待返工验收","Platform fee remains reserved, waiting for rework acceptance"
"Agent 收入暂停，等待返工补交","Agent income is paused, waiting for rework resubmission"
"买方验收待决策","Buyer acceptance awaiting decision"
"买方已要求返工","Buyer requested rework"
"交付证据已锁定，当前页不释放托管","Delivery evidence is locked; this page does not release escrow"
"返工请求已写入，托管继续冻结","Rework request saved; escrow remains frozen"
"交付证据已锁定，托管结算已流转","Delivery evidence is locked; escrow settlement has flowed"
"平台服务费预留","Platform fee reserved"
"Agent 待释放收入","Agent income pending release"
"验收门禁","Acceptance gate"
"打开本页只审阅交付证据，不会释放托管；只有点击“确认验收并放款”才会写入放款账本。","Opening this page only reviews delivery evidence and does not release escrow; only clicking ""Confirm acceptance and release funds"" writes release ledger entries."
"验收决策","Acceptance decision"
"买方必须基于证据选择下一步：通过验收、要求返工，或在形成快照后进入退款/争议分支。","The buyer must choose the next step from evidence: accept, request rework, or enter refund/dispute after a snapshot exists."
"执行验收","Execute acceptance"
"要求返工","Request rework"
"当前不可直接执行","Not directly executable now"
"提交争议仲裁申请","Submit dispute arbitration application"
"提交退款复核申请","Submit refund review application"
"预览争议仲裁申请","Preview dispute arbitration application"
"预览退款复核申请","Preview refund review application"
"已有结算分支，当前页只展示已提交申请和账本状态","A settlement branch already exists; this page only shows the submitted application and ledger state"
"仅预览申请，尚未创建结算分支或改写托管账本","Application preview only; no settlement branch has been created and the escrow ledger is unchanged"
"买方申请原因：%{1}","Buyer application reason: %{1}"
"买方期望结果：%{1}","Buyer desired outcome: %{1}"
"补充证据说明：%{1}","Additional evidence note: %{1}"
"交付证据未达到验收标准，买方请求暂停结算并复核退款。","Delivery evidence did not meet acceptance standards, so the buyer requests settlement pause and refund review."
"买方质疑交付范围、权限或异常处理，需要仲裁员复核。","The buyer disputes delivery scope, permissions, or exception handling and needs arbitrator review."
"退款、补证后再验收，或按裁决调整平台服务费。","Refund, re-accept after additional evidence, or adjust the platform fee by ruling."
"由仲裁员裁定放款、退款、部分放款或返工。","Arbitrator decides release, refund, partial release, or rework."
"引用验收记录、交付哈希、执行日志和缺失证据清单。","Reference acceptance record, delivery hash, execution logs, and missing-evidence checklist."
"引用验收记录、范围说明、权限日志、输出哈希和异常清单。","Reference acceptance record, scope notes, permission logs, output hash, and exception checklist."
"退款复核原因","Refund review reason"
"争议仲裁原因","Dispute arbitration reason"
"期望处理结果","Desired outcome"
"证据说明","Evidence note"
"提交前只生成申请预览，不创建案件、不冻结资金、不改写账本。","Before submission this is only an application preview; no case is created, funds are not frozen, and the ledger is unchanged."
"提交后平台进入退款复核，Agent 收入暂停结算。","After submission the platform enters refund review and Agent income settlement is paused."
"提交后资金进入争议冻结，仲裁员才能签发最终裁决。","After submission funds enter dispute hold and only the arbitrator can issue a final ruling."
"退款复核申请待提交","Refund review application awaiting submission"
"争议仲裁申请待提交","Dispute arbitration application awaiting submission"
"未创建","Not created"
"申请预览","Application preview"
"提交前账本不变","Ledger unchanged before submission"
"争议仲裁申请","Dispute arbitration application"
"退款复核申请","Refund review application"
"买方需要先提交结构化申请，系统才会创建案件、冻结或改写托管账本。","The buyer must submit a structured application before the system creates a case, freezes funds, or changes the escrow ledger."
"申请原因","Application reason"
"提交申请","Submit application"
"提交后证据包预览","Evidence package preview after submission"
"争议申请已提交","Dispute application submitted"
"退款申请已提交","Refund application submitted"
"申请已写入结算分支，当前页面展示可审计证据、账本影响和后续处理流程。","The application has been written to the settlement branch; this page shows auditable evidence, ledger impact, and the next workflow."
"资金已进入争议冻结，等待仲裁员复核并签发裁决。","Funds have entered dispute hold and are waiting for arbitrator review and ruling."
"退款复核已开启，Agent 收入暂停结算，平台等待补证或裁决。","Refund review is open, Agent income settlement is paused, and the platform is waiting for additional evidence or a ruling."
"已登录买方账号 #%{1}","Logged-in buyer account #%{1}"
"真实账号已解析","Real account resolved"
"权限契约待实证","Permission contract pending proof"
"仅原型绑定","Prototype binding only"
"待绑定身份","Identity not yet bound"
"前台客户会话","Frontend customer session"
"Agent 运营契约","Agent operator contract"
"后台 ACL 契约","Backend ACL contract"
"原型会话声明","Prototype session claim"
"未解析","Unresolved"
"真实账号会话已解析，可进入生产校验链。","A real account session has been resolved and can enter the production verification chain."
"已有权限契约，但仍需接入 Weline ACL 实证。","A permission contract exists, but Weline ACL proof still needs to be connected."
"仅可用于演示，不能作为生产放款或仲裁依据。","For demo use only; it cannot support production payout or arbitration decisions."
"尚未绑定身份主体。","No identity subject has been bound yet."
"无身份解析证据","No identity resolution evidence"
"身份解析证据待补齐","Identity resolution evidence pending"
"存在仅原型身份绑定，不能作为生产放款、退款或仲裁依据。","Some identities are prototype-only and cannot support production payout, refund, or arbitration decisions."
"存在权限契约待实证角色，下一步需要接入真实 Weline ACL 或 Agent 运营账号校验。","Some roles have permission contracts pending proof; next connect real Weline ACL or Agent operator account verification."
"生产级身份链尚未完成，敏感写动作当前只完成角色归属守卫与身份缺口提示。","The production identity chain is incomplete; sensitive writes currently have role ownership guards and identity-gap warnings only."
"所有订单角色均已进入生产级身份校验链。","All order roles have entered the production identity verification chain."
"身份就绪","Identity readiness"
"生产级身份状态","Production identity status"
"区分真实账号、权限契约与原型绑定，避免把演示授权误判为生产授权。","Distinguish real accounts, permission contracts, and prototype bindings so demo authorization is not mistaken for production authorization."
"生产可用身份","Production-ready identities"
"原型绑定","Prototype bindings"
"身份来源","Identity source"
"证据","Evidence"
"未绑定","Not bound"
"无运行时实证","No runtime proof"
"需要先绑定订单角色。","Bind the order role first."
"运行时已实证","Runtime proof passed"
"当前前台客户会话与订单买方绑定主体一致。","The current frontend customer session matches the bound buyer subject."
"无","None"
"会话未匹配","Session not matched"
"绑定主体是真实买方账号，但当前请求没有证明同一会话。","The bound subject is a real buyer account, but this request does not prove the same session."
"需要用同一买方账号登录后再执行生产动作。","Log in with the same buyer account before running production actions."
"Agent 运营账号待接入","Agent operator account pending"
"当前只有 Agent 运营契约，没有真实运营账号或 ACL 运行时校验。","Only the Agent operator contract exists; no real operator account or ACL runtime check is connected."
"需要接入 Agent 运营账号或后台 ACL Source：%{1}","Connect an Agent operator account or backend ACL Source: %{1}"
"后台 ACL 待接入","Backend ACL pending"
"当前页面是前台请求，不能证明后台 ACL 会话或角色权限。","This page is a frontend request and cannot prove a backend ACL session or role permission."
"需要后台 ACL Source：%{1} 并通过后台会话校验。","Requires backend ACL Source: %{1} and backend session verification."
"缺少运行时实证","Runtime proof missing"
"当前为原型会话声明，不能作为生产授权证据。","This is a prototype session claim and cannot be production authorization evidence."
"需要真实登录账号、Agent 运营账号或后台 ACL 校验。","Requires a real login account, Agent operator account, or backend ACL check."
"绑定主体存在，但当前请求尚未提供可验证运行时证明。","A bound subject exists, but this request has not provided verifiable runtime proof."
"需要补齐与角色匹配的会话、账号或 ACL 证据。","Add session, account, or ACL evidence that matches the role."
"生产级运行时实证未完成，当前仍不能声明放款、退款或仲裁生产授权。","Production runtime proof is incomplete, so payout, refund, or arbitration authority cannot be claimed."
"所有订单角色均已通过运行时实证。","All order roles have passed runtime proof."
"运行时实证","Runtime proof"
"区分真实账号、权限契约、后台 ACL 和原型绑定，避免把合同就绪误判为生产授权。","Distinguish real accounts, permission contracts, backend ACL, and prototype bindings so contract readiness is not mistaken for production authorization."
"运行时缺口","Runtime proof gaps"
"实证证据","Proof evidence"
"缺口","Gap"
"ACL 来源","ACL source"
"A2A 运行时实证","A2A runtime proof"
"A2A 交易运行时实证与权限源注册","A2A transaction runtime proof and permission-source registration"
"查看 A2A 实证源","View A2A proof sources"
"查看 A2A 运行时实证源状态","View A2A runtime proof source status"
"A2A 后台 ACL Source 已注册，前台交易动作仍需运行时会话实证。","A2A backend ACL Sources are registered; frontend trade actions still require runtime session proof."
"A2A Agent 运营账号","A2A Agent operator account"
"Agent 运营账号执行交付与证据提交的后台权限","Backend permission for Agent operators to execute delivery and submit evidence"
"A2A 平台风控","A2A platform risk"
"平台风控复核、冻结、退款复核与钱包监控权限","Permission for platform risk review, holds, refund review, and wallet monitoring"
"A2A 仲裁席位","A2A arbitration panel"
"仲裁证据复核与最终裁决签发权限","Permission for arbitration evidence review and final ruling issuance"
"此后台入口只证明 ACL Source 已注册；是否允许交易动作仍由角色绑定和运行时会话共同判断。","This backend entry only proves the ACL Source is registered; trade-action permission is still decided by role binding and runtime session proof together."
"Agent 运营账号实证","Agent operator account proof"
"平台风控 ACL 实证","Platform risk ACL proof"
"仲裁席位 ACL 实证","Arbitration panel ACL proof"
"无 ACL 来源","No ACL source"
"当前角色不需要后台 ACL Source。","This role does not require a backend ACL Source."
"ACL Source 已注册","ACL Source registered"
"Weline ACL 表已存在 Source：%{1}","The Weline ACL table contains Source: %{1}"
"ACL Source 查询失败","ACL Source lookup failed"
"查询 ACL Source 时发生错误：%{1}","An error occurred while querying ACL Source: %{1}"
"ACL Source 未注册","ACL Source not registered"
"Weline ACL 表未找到 Source：%{1}","The Weline ACL table does not contain Source: %{1}"
"ACL 注册","ACL registration"
"后台实证入口","Backend proof entry"
"打开后台 ACL 实证","Open backend ACL proof"
"该入口由 Weline 后台 URL 生成器生成，裸路由不会作为生产验证入口。","This entry is generated by Weline's backend URL builder; the bare route is not a production verification entry."
"后台会话已进入 A2A ACL 实证区。","The backend session has entered the A2A ACL proof area."
"需要先登录后台后才能查看 A2A ACL 实证。","Log in to the backend before viewing A2A ACL proof."
"后台 ACL 实证只证明后台会话可进入该 Source；订单级付款、退款、交付、仲裁仍必须绑定交易角色和订单上下文。","Backend ACL proof only proves the backend session can enter this Source; order-level payment, refund, delivery, and arbitration still require trade-role binding and order context."
"当前后台会话已通过 ACL 路由守卫进入 Source：%{1}","The current backend session passed the ACL route guard for Source: %{1}"
"当前请求尚未形成可用的后台会话 ACL 实证。","The current request has not produced usable backend-session ACL proof."
"尚未绑定具体订单角色和交易动作；不能仅凭 ACL 实证执行付款、退款、交付或仲裁。","No specific order role and trade action are bound yet; ACL proof alone cannot execute payment, refund, delivery, or arbitration."
"后台运营用户查询失败：%{1}","Backend operator user lookup failed: %{1}"
"尚未找到可用的后台运营用户。","No available backend operator user was found."
"后台运营用户 #%{1}","backend operator user #%{1}"
"已解析到启用的后台运营用户；交易交付、放款和仲裁仍必须通过订单级运行时守卫。","An enabled backend operator user has been resolved; trade delivery, payout, and arbitration must still pass order-level runtime guards."
"后台用户 #%{1} 已启用，绑定到 Agent 供给方 %{2}。","Backend user #%{1} is enabled and bound to Agent provider %{2}."
"Agent 运营后台用户","Agent operator backend user"
"Agent 运营账号已绑定","Agent operator account bound"
"Agent 供给方已解析到启用后台运营用户；当前前台请求仍不能证明该后台用户正在执行订单动作。","The Agent provider resolved to an enabled backend operator user; this frontend request still does not prove that backend user is executing the order action."
"需要把后台运营用户会话、Agent ACL Source 和订单动作上下文一起接入运行时守卫。","Connect the backend operator user session, Agent ACL Source, and order action context into the runtime guard together."
