客服人员管理,客服人员管理
加载客服人员失败：%{1},"โหลดตัวแทนล้มเหลว: %{1}"
客服名称不能为空,ชื่อตัวแทนไม่สามารถว่างเปล่าได้
邮箱格式不正确,รูปแบบอีเมลไม่ถูกต้อง
请选择后台用户,กรุณาเลือกผู้ใช้แบ็กเอนด์
客服人员不存在,ตัวแทนไม่มีอยู่
保存成功,บันทึกสำเร็จ
保存失败：%{1},"บันทึกล้มเหลว: %{1}"
无效的客服ID,"ID ตัวแทนไม่ถูกต้อง"
删除成功,ลบสำเร็จ
删除失败：%{1},"ลบล้มเหลว: %{1}"
获取成功,ดึงข้อมูลสำเร็จ
获取统计数据失败：%{1},"ดึงสถิติล้มเหลว: %{1}"
客服配置,การตั้งค่าบริการลูกค้า
加载配置失败：%{1},"โหลดการตั้งค่าล้มเหลว: %{1}"
您不是客服人员，无法使用工作台,"คุณไม่ใช่ตัวแทนบริการลูกค้า ไม่สามารถใช้คอนโซลได้"
客服工作台,คอนโซลบริการลูกค้า
加载工作台失败：%{1},"โหลดคอนโซลล้มเหลว: %{1}"
您不是客服人员,คุณไม่ใช่ตัวแทนบริการลูกค้า
获取会话列表失败：%{1},"ดึงรายการเซสชันล้มเหลว: %{1}"
无效的会话ID,"ID เซสชันไม่ถูกต้อง"
会话不存在,เซสชันไม่มีอยู่
无权访问此会话,ไม่มีสิทธิ์เข้าถึงเซสชันนี้
获取消息失败：%{1},"ดึงข้อความล้มเหลว: %{1}"
消息内容不能为空,เนื้อหาข้อความไม่สามารถว่างเปล่าได้
发送成功,ส่งสำเร็จ
发送消息失败：%{1},"ส่งข้อความล้มเหลว: %{1}"
会话已被分配,เซสชันถูกมอบหมายแล้ว
已达到最大会话数限制,ถึงขีดจำกัดจำนวนเซสชันสูงสุดแล้ว
分配成功,มอบหมายสำเร็จ
分配会话失败：%{1},"มอบหมายเซสชันล้มเหลว: %{1}"
无权关闭此会话,ไม่มีสิทธิ์ปิดเซสชันนี้
会话已关闭,เซสชันปิดแล้ว
关闭会话失败：%{1},"ปิดเซสชันล้มเหลว: %{1}"
获取客服状态失败：%{1},"ดึงสถานะตัวแทนล้มเหลว: %{1}"
会话管理,การจัดการเซสชัน
加载会话失败：%{1},"โหลดเซสชันล้มเหลว: %{1}"
会话详情,รายละเอียดเซสชัน
加载会话详情失败：%{1},"โหลดรายละเอียดเซสชันล้มเหลว: %{1}"
邮箱地址不能为空,ที่อยู่อีเมลไม่สามารถว่างเปล่าได้
会话令牌不能为空,โทเค็นเซสชันไม่สามารถว่างเปล่าได้
验证邮件已发送，请查收,"ส่งอีเมลยืนยันแล้ว กรุณาตรวจสอบ"
发送验证邮件失败，请稍后重试,"ส่งอีเมลยืนยันล้มเหลว กรุณาลองใหม่อีกครั้งในภายหลัง"
发送验证邮件失败：%{1},"ส่งอีเมลยืนยันล้มเหลว: %{1}"
验证令牌不能为空,โทเค็นยืนยันไม่สามารถว่างเปล่าได้
验证令牌无效或已过期,โทเค็นยืนยันไม่ถูกต้องหรือหมดอายุแล้ว
邮箱绑定成功,ผูกอีเมลสำเร็จ
邮箱绑定失败，请稍后重试,"ผูกอีเมลล้มเหลว กรุณาลองใหม่อีกครั้งในภายหลัง"
验证失败：%{1},"ยืนยันล้มเหลว: %{1}"
客服聊天,แชทบริการลูกค้า
获取会话失败：%{1},"ดึงเซสชันล้มเหลว: %{1}"
语言代码不能为空,รหัสภาษาไม่สามารถว่างเปล่าได้
语言设置成功,ตั้งค่าภาษาสำเร็จ
设置语言失败：%{1},"ตั้งค่าภาษาล้มเหลว: %{1}"
客服消息翻译,การแปลข้อความบริการลูกค้า
客服模块通过此事件请求翻译服务。事件数据包含待翻译文本、源语言、目标语言等。翻译模块可以监听此事件并提供翻译服务。,"โมดูลบริการลูกค้าขอใช้บริการแปลผ่านเหตุการณ์นี้ ข้อมูลเหตุการณ์รวมถึงข้อความที่ต้องแปล ภาษาต้นฉบับ ภาษาปลายทาง เป็นต้น โมดูลแปลสามารถฟังเหตุการณ์นี้และให้บริการแปลได้"
"客服服务 - 邮箱绑定验证","บริการลูกค้า - การยืนยันการผูกอีเมล"
客服系统,ระบบบริการลูกค้า
客服服务,บริการลูกค้า
检测中...,กำลังตรวจสอบ...
设置,การตั้งค่า
收起,ย่อลง
我的语言,ภาษาของฉัน
简体中文,จีนตัวย่อ
繁體中文,จีนตัวเต็ม
显示模式,โหมดแสดงผล
仅显示译文,แสดงเฉพาะคำแปล
原文+译文,"ต้นฉบับ + คำแปล"
仅显示原文,แสดงเฉพาะต้นฉบับ
欢迎使用客服服务！,ยินดีต้อนรับสู่บริการลูกค้า!
请输入您的问题，我们的客服将尽快为您解答。,"กรุณากรอกคำถามของคุณ และทีมบริการลูกค้าของเราจะตอบกลับโดยเร็วที่สุด"
输入消息...,พิมพ์ข้อความ...
接收客服回复与优惠通知,接收客服回复与优惠通知
留下邮箱后，客服可将本次咨询的回复、报价进展和可用优惠发送到您的邮箱。,留下邮箱后，客服可将本次咨询的回复、报价进展和可用优惠发送到您的邮箱。
仅用于本次客服咨询相关通知，不是简报订阅。,仅用于本次客服咨询相关通知，不是简报订阅。
接收通知的邮箱,接收通知的邮箱
请输入用于接收客服通知的邮箱,请输入用于接收客服通知的邮箱
稍后再说,稍后再说
发送验证邮件,ส่งอีเมลยืนยัน
等待中,กำลังรอ
暂无消息,ไม่มีข้อความ
接单,รับ
暂无会话,ไม่มีเซสชัน
会话,เซสชัน
关闭会话,ปิดเซสชัน
发送,ส่ง
发送失败,ส่งล้มเหลว
发送失败，请稍后重试,"ส่งล้มเหลว กรุณาลองใหม่อีกครั้งในภายหลัง"
确定要接单此会话吗？,คุณแน่ใจหรือไม่ว่าต้องการรับเซสชันนี้?
分配失败,มอบหมายล้มเหลว
分配失败，请稍后重试,"มอบหมายล้มเหลว กรุณาลองใหม่อีกครั้งในภายหลัง"
确定要关闭此会话吗？,คุณแน่ใจหรือไม่ว่าต้องการปิดเซสชันนี้?
请选择一个会话开始聊天,กรุณาเลือกเซสชันเพื่อเริ่มแชท
关闭失败,ปิดล้มเหลว
关闭失败，请稍后重试,"ปิดล้มเหลว กรุณาลองใหม่อีกครั้งในภายหลัง"
刚刚,เมื่อสักครู่
分钟前,นาทีที่แล้ว
小时前,ชั่วโมงที่แล้ว
已关闭,ปิดแล้ว
进行中,กำลังดำเนินการ
最快,เร็วที่สุด
最慢,ช้าที่สุด
最短,สั้นที่สุด
分钟,นาที
最长,ยาวที่สุด
秒,วินาที
客服会话初始化失败，请稍后重试,客服会话初始化失败，请稍后重试
欢迎使用客服服务,欢迎使用客服服务
鐎广垺婀囬崷銊у殠,鐎广垺婀囬崷銊у殠
"AI 智能客服","บริการลูกค้า AI"
鐎广垺婀囩粋鑽ゅ殠,鐎广垺婀囩粋鑽ゅ殠
请输入有效的邮箱地址,กรุณากรอกที่อยู่อีเมลที่ถูกต้อง
会话未初始化，请刷新页面重试,"เซสชันยังไม่ได้เริ่มต้น กรุณารีเฟรชหน้าและลองอีกครั้ง"
验证邮件已发送，请查收您的邮箱,"ส่งอีเมลยืนยันแล้ว กรุณาตรวจสอบอีเมลของคุณ"
添加客服,เพิ่มตัวแทน
ID,ID
客服名称,ชื่อตัวแทน
关联用户,ผู้ใช้ที่เชื่อมโยง
邮箱,อีเมล
语言,ภาษา
状态,สถานะ
最大会话数,จำนวนเซสชันสูงสุด
总会话数,จำนวนเซสชันทั้งหมด
总消息数,จำนวนข้อความทั้งหมด
平均响应时间,เวลาเฉลี่ยในการตอบกลับ
操作,การดำเนินการ
暂无客服人员,ไม่มีตัวแทนบริการลูกค้า
支持的语言,ภาษาที่รองรับ
激活,เปิดใช้งาน
禁用,ปิดการใช้งาน
查看统计,ดูสถิติ
编辑,แก้ไข
删除,ลบ
关联后台用户,เชื่อมโยงผู้ใช้แบ็กเอนด์
请选择用户,กรุณาเลือกผู้ใช้
请输入客服名称,กรุณากรอกชื่อตัวแทน
请输入邮箱地址,กรุณากรอกที่อยู่อีเมล
主要语言,ภาษาหลัก
客服的首选沟通语言,ภาษาที่ตัวแทนชอบใช้ในการสื่อสาร
客服可以接待的所有语言（勾选多个可接待全球客户）,"ภาษาทั้งหมดที่ตัวแทนสามารถให้บริการได้ (เลือกหลายภาษาสำหรับลูกค้าทั่วโลก)"
最大并发会话数,จำนวนเซสชันพร้อมกันสูงสุด
激活状态,สถานะการเปิดใช้งาน
取消,ยกเลิก
保存,บันทึก
编辑客服,แก้ไขตัวแทน
提示,提示
确认,确认
保存失败,บันทึกล้มเหลว
确定要删除此客服吗？,คุณแน่ใจหรือไม่ว่าต้องการลบตัวแทนนี้?
删除确认,删除确认
删除失败,ลบล้มเหลว
获取统计数据失败,ดึงสถิติล้มเหลว
客服统计详情,รายละเอียดสถิติตัวแทน
会话统计,สถิติเซสชัน
消息统计,สถิติข้อความ
响应时间,เวลาในการตอบกลับ
平均,เฉลี่ย
会话时长,ระยะเวลาเซสชัน
启用客服服务,เปิดใช้งานบริการลูกค้า
启用,启用
默认客服语言,ภาษาตัวแทนเริ่มต้น
English,English
默认客户语言,ภาษาลูกค้าเริ่มต้น
"当没有客服人员在线时，可启用 AI 自动回复客户消息。","เมื่อไม่มีตัวแทนบริการลูกค้าออนไลน์ สามารถเปิดใช้งาน AI เพื่อตอบกลับข้อความลูกค้าอัตโนมัติ"
"启用 AI 自动回复","เปิดใช้งานการตอบกลับอัตโนมัติ AI"
"启用后，客户端将显示蓝色""AI 智能客服""状态而非灰色""离线""","เมื่อเปิดใช้งานแล้ว ไคลเอนต์จะแสดงสถานะ ""บริการลูกค้า AI"" สีน้ำเงินแทน ""ออฟไลน์"" สีเทา"
"AI 模型","โมเดล AI"
"使用的 AI 模型标识，需在 Weline_Ai 模块中配置对应供应商","ตัวระบุโมเดล AI ที่ใช้ ต้องกำหนดค่าโปรวาเดอร์ที่เกี่ยวข้องในโมดูล Weline_Ai"
保存配置,บันทึกการตั้งค่า
客服,ตัวแทน
工作量统计,สถิติปริมาณงาน
今日,วันนี้
本周,สัปดาห์นี้
本月,เดือนนี้
全部,ทั้งหมด
会话数,会话数
消息数,ข้อความ
客户,ลูกค้า
响应率,อัตราการตอบกลับ
已响应,ตอบกลับแล้ว
完结率,อัตราการปิด
平均会话时长（分钟）,"ระยะเวลาเฉลี่ยของเซสชัน (นาที)"
平均消息,ข้อความเฉลี่ย
会话列表,รายการเซสชัน
刷新,รีเฟรช
等待分配,รอการมอบหมาย
我的会话,เซสชันของฉัน
全部状态,สถานะทั้งหมด
会话ID,"ID เซสชัน"
客户ID,"ID ลูกค้า"
客户语言,ภาษาลูกค้า
客服语言,ภาษาตัวแทน
创建时间,เวลาที่สร้าง
查看,ดู
关闭,ปิด
返回列表,กลับไปที่รายการ
会话信息,ข้อมูลเซสชัน
客服ID,"ID ตัวแทน"
聊天记录,ประวัติการแชท
翻译：,แปล:
邮箱绑定验证,การยืนยันการผูกอีเมล
验证成功,ยืนยันสำเร็จ
您的邮箱,อีเมลของคุณ
已成功绑定到客服会话。,ผูกกับเซสชันบริการลูกค้าสำเร็จแล้ว
返回首页,กลับไปที่หน้าแรก
验证失败,ยืนยันล้มเหลว
已绑定邮箱,อีเมลที่ผูกแล้ว
绑定成功后，您将收到客服回复的邮件通知,"หลังจากผูกสำเร็จแล้ว คุณจะได้รับการแจ้งเตือนทางอีเมลสำหรับการตอบกลับของบริการลูกค้า"
返回上一页,กลับไปหน้าก่อนหน้า
如有问题，请,"หากคุณมีคำถามใด ๆ กรุณา"
联系客服,ติดต่อบริการลูกค้า
此页面用于独立聊天界面，实际聊天功能通过右下角悬浮按钮使用。,"หน้านี้ใช้สำหรับอินเทอร์เฟซแชทแบบสแตนด์อโลน ฟังก์ชันแชทจริงสามารถใช้ได้ผ่านปุ่มลอยที่มุมขวาล่าง"
